{
  "schema": "focusa.ui_eval_compact_summary.v1",
  "scenario_id": "spec135-ri2-grill-interview-strategy",
  "status": "incomplete",
  "browser_session_refs": [],
  "browser_context_refs": [
    "focusa-cont-mission-canvas-57e8c074-539f-44a2-86f6-527b478f9d80",
    "attachment:ri2-interview"
  ],
  "step_results": [
    {
      "step_id": "open",
      "status": "unverified",
      "result": "UIAI opened the generated Grill Interview strategy surface at 1440x1000.",
      "evidence_refs": [
        "redacted-private-reference"
      ],
      "reported_status": "passed"
    },
    {
      "step_id": "propose",
      "status": "unverified",
      "result": "One action selected the higher-value non-goal question inside the active scope branch rather than the global Discovery blocker.",
      "evidence_refs": [
        "redacted-private-reference",
        "context-source:f063e9284338919fd6276238",
        "project-role-profile:e21d217860c356b6bc7e30d1"
      ],
      "reported_status": "passed"
    },
    {
      "step_id": "authority",
      "status": "unverified",
      "result": "UIAI Eval observed status=completed, actions=1, tranche=boundary, branch=scope, recommendationRefs=1, retrievalFirst=true, oneQuestion=true, operator authority=true.",
      "evidence_refs": [
        "redacted-private-reference"
      ],
      "reported_status": "passed"
    },
    {
      "step_id": "mobile",
      "status": "unverified",
      "result": "At 390x844 the body width equaled the viewport, horizontal overflow was false, and Run Grill Strategy remained 310 pixels wide.",
      "evidence_refs": [
        "redacted-private-reference"
      ],
      "reported_status": "passed"
    },
    {
      "step_id": "diagnostics",
      "status": "unverified",
      "result": "Final diagnostics reported zero console errors, warnings, exceptions, failed requests, HTTP 4xx, and HTTP 5xx across seven requests.",
      "evidence_refs": [
        "redacted-private-reference"
      ],
      "reported_status": "passed"
    },
    {
      "step_id": "close",
      "status": "unverified",
      "result": "The browser session and temporary proof processes were closed after evidence capture.",
      "evidence_refs": [
        "redacted-private-reference"
      ],
      "reported_status": "passed"
    }
  ],
  "artifact_refs": [
    "packages/a2ui-renderer/proof/interview-strategy.html",
    "packages/a2ui-renderer/proof/interview-strategy.ts",
    "redacted-private-reference",
    "redacted-private-reference"
  ],
  "diagnostics_ref": "redacted-private-reference",
  "limitations": [
    "The strategy is advisory and deliberately does not persist Interview questions or answers; RI3 owns canonical Interview state."
  ],
  "completed_at": "2026-07-21T15:32:09Z",
  "public_evidence_disposition": "private browser/session evidence redacted; no public artifact is claimed",
  "source_schema": "uiai.focusa_ui_eval_result.v1",
  "reported_status": "passed",
  "verification_status": "incomplete",
  "closure_eligible": false
}
