{
  "schema": "focusa.ui_eval_compact_summary.v1",
  "scenario_id": "spec135-st1-adversarial-spec-workbench",
  "status": "incomplete",
  "browser_session_refs": [],
  "browser_context_refs": [
    "focusa-cont-mission-canvas-57e8c074-539f-44a2-86f6-527b478f9d80",
    "attachment:st1-workbench"
  ],
  "step_results": [
    {
      "step_id": "open",
      "status": "unverified",
      "result": "Generated Spec Workbench rendered.",
      "evidence_refs": [
        "redacted-private-reference"
      ],
      "reported_status": "passed"
    },
    {
      "step_id": "lifecycle",
      "status": "unverified",
      "result": "Session revision 10 resumed exact section; section revision 2 approved with one resolved objection, one amendment, and two operator gates.",
      "evidence_refs": [
        "redacted-private-reference"
      ],
      "reported_status": "passed"
    },
    {
      "step_id": "mobile",
      "status": "unverified",
      "result": "390px body matched viewport; overflow false; action width 302px.",
      "evidence_refs": [
        "redacted-private-reference"
      ],
      "reported_status": "passed"
    },
    {
      "step_id": "diagnostics",
      "status": "unverified",
      "result": "Zero errors, warnings, exceptions, failed requests, 4xx, and 5xx across 25 requests.",
      "evidence_refs": [
        "redacted-private-reference"
      ],
      "reported_status": "passed"
    }
  ],
  "artifact_refs": [
    "packages/a2ui-renderer/proof/spec-workbench.html",
    "packages/a2ui-renderer/proof/spec-workbench.ts",
    "redacted-private-reference"
  ],
  "diagnostics_ref": "redacted-private-reference",
  "limitations": [],
  "completed_at": "2026-07-21T23:54:23Z",
  "public_evidence_disposition": "private browser/session evidence redacted; no public artifact is claimed",
  "source_schema": "uiai.focusa_ui_eval_result.v1",
  "reported_status": "passed",
  "verification_status": "incomplete",
  "closure_eligible": false
}
